{
  "id": null,
  "productId": "minim",
  "locationType": "PARTNER",
  "productName": "qui ad Lorem nisi eiusmod",
  "locationId": "consequat",
  "auditInfo": {
    "isDeleted": false,
    "createdBy": "quis qui consequat cillum",
    "updatedBy": "in",
    "updatedDate": null,
    "createdDate": "1958-02-04T16:20:29.81Z"
  },
  "locationName": "dolore ea",
  "quantityInStock": -21423318,
  "externalId": "sit officia elit",
  "variantId": "amet dolor voluptate est nisi"
}
